{
  "protocol_version": 1,
  "request_id": "aaaaaaaa-aaaa-4aaa-8aaa-aaaaaaaaaaa4",
  "server_time": "2026-08-13T17:02:00.000Z",
  "device_id": "11111111-1111-4111-8111-111111111111",
  "credential_id": "44444444-4444-4444-8444-444444444444",
  "state": "revoked",
  "disposition": "newly_revoked",
  "revoked_at": "2026-08-13T17:02:00.000Z"
}
